{"schemaVersion":1,"id":"rote77_live_effect","songCode":"rote77","variant":"","title":"ROUTE77","source":{"liveEffectCsv":"rote77_live_effect.csv","indexSha256":"e3565c25167757077db4fca7e5314a0421bfdca3a6c64eaa7d6a3f019a8a645a","entrySha256":"50dd55040de3c81d01ae69f0c492397e314b7a344e14a29c430b305acab4adb4","audioCatalogSha256":"91ff53dc971c4d03207795cb234a33e00e10e551ff8e448b00f59d744bf3bc0e"},"timeUnit":"ms","startTimeMs":-2000,"durationMs":136000,"positions":[2,3],"performerSlots":[1,2],"stagePositionMap":[{"performerSlot":1,"stagePosition":3},{"performerSlot":2,"stagePosition":2}],"singerEvents":[{"time":12900,"singers":[3],"stagePositions":[3],"performerSlots":[1]},{"time":18000,"singers":[],"stagePositions":[],"performerSlots":[]},{"time":18750,"singers":[3],"stagePositions":[3],"performerSlots":[1]},{"time":24200,"singers":[2],"stagePositions":[2],"performerSlots":[2]},{"time":30000,"singers":[2],"stagePositions":[2],"performerSlots":[2]},{"time":37000,"singers":[3],"stagePositions":[3],"performerSlots":[1]},{"time":41600,"singers":[2],"stagePositions":[2],"performerSlots":[2]},{"time":44500,"singers":[2,3],"stagePositions":[2,3],"performerSlots":[1,2]},{"time":47500,"singers":[2,3],"stagePositions":[2,3],"performerSlots":[1,2]},{"time":53200,"singers":[3],"stagePositions":[3],"performerSlots":[1]},{"time":59000,"singers":[2,3],"stagePositions":[2,3],"performerSlots":[1,2]},{"time":64900,"singers":[2],"stagePositions":[2],"performerSlots":[2]},{"time":71200,"singers":[2,3],"stagePositions":[2,3],"performerSlots":[1,2]},{"time":74500,"singers":[2,3],"stagePositions":[2,3],"performerSlots":[1,2]},{"time":98000,"singers":[3],"stagePositions":[3],"performerSlots":[1]},{"time":102700,"singers":[2],"stagePositions":[2],"performerSlots":[2]},{"time":105600,"singers":[2,3],"stagePositions":[2,3],"performerSlots":[1,2]},{"time":108500,"singers":[3],"stagePositions":[3],"performerSlots":[1]},{"time":114350,"singers":[2],"stagePositions":[2],"performerSlots":[2]},{"time":120000,"singers":[2,3],"stagePositions":[2,3],"performerSlots":[1,2]},{"time":126000,"singers":[2,3],"stagePositions":[2,3],"performerSlots":[1,2]},{"time":132000,"singers":[2,3],"stagePositions":[2,3],"performerSlots":[1,2]}],"lyricEvents":[{"time":12900,"text":"真っ直ぐ伸びる道の先は何が待ってんの？","duration":10000},{"time":18750,"text":"高鳴る予感ど真ん中 パルス上がってく","duration":10000},{"time":24200,"text":"エンジン鼓動(ビート)-連動 うなれ喜びを","duration":10000},{"time":30000,"text":"ゴキゲン速度(スピード)めがけりゃ革ジャン引き締まる","duration":10000},{"time":37000,"text":"風よ大地よ 準備はいいか？","duration":10000},{"time":41600,"text":"果てない夢へ HEY,MACHINE！GO AHEAD！","duration":10000,"rawText":"果てない夢へ HEY<comma>MACHINE！GO AHEAD！"},{"time":44500,"text":"超爆速本気(マジ)ライダー","duration":10000},{"time":47500,"text":"飛ばせ 流るる星の如く ぶっちぎれOUR WAY","duration":10000},{"time":53200,"text":"大事なモン貫くため走れDUDES！","duration":10000},{"time":59000,"text":"加速するたびアツくなれシグナルは\"進め\"","duration":10000},{"time":64900,"text":"思うまま自由に 瞬いていこうぜ","duration":10000},{"time":71200,"text":"どんなルートも怖くねぇ","duration":10000},{"time":74500,"text":"Oi Oi Oi Oi Oi","duration":100000},{"time":98000,"text":"風よ大地よ きいてくれ","duration":10000},{"time":102700,"text":"オレたちの鼓動(ビート)HEY,BUDDY！GO AHEAD！","duration":10000,"rawText":"オレたちの鼓動(ビート)HEY<comma>BUDDY！GO AHEAD！"},{"time":105600,"text":"超神速夢(ドリーム)ライダー","duration":10000},{"time":108500,"text":"飛ばせ 流るる星の如く ぶっちぎれOUR WAY","duration":10000},{"time":114350,"text":"大事なモンを持ってること誇れDUDES！","duration":10000},{"time":120000,"text":"加速するたびアツくなれシグナルは\"進め\"","duration":10000},{"time":126000,"text":"思うまま自由に 瞬いていこうぜ","duration":10000},{"time":132000,"text":"どんな明日も なぁ？相棒","duration":10000}],"audioRef":{"url":"/assets/live-chibi/music/rote77.m4a","sourceSha256":"dd138a054759f9b6ba3e54013a56857758eee2996740bc527959736ab6ee84d8","derivedSha256":"a369be0bcd5abac9539ee6a1765a9e0b38caeb6e3d70a5e87aef298ffddb7cf0","durationSeconds":138.181837},"timelineToAudio":{"status":"unverified","offsetMs":null},"capabilities":{"audio":{"evidence":"full_mix_catalog","resource":"local_present","tested":"not_tested"},"lyrics":{"evidence":"timed_source","alignment":"unverified","tested":"not_tested"},"stage":{"kind":"choreography_candidate","evidence":"live_effect_index","resource":"not_assessed","tested":"not_tested"}}}
